{"schema_version":"1.0","experiment_id":"btc-eth-long-only-mean-reversion-v2","verdict":"PASS_FIDELITY_APPROVED_FOR_FORMAL_DEVELOPMENT_EVALUATION","source_commit":"64cf0211924bd77f5080345241b7d201fed4bcc9","evidence_implementation_commit":"9eee066e0a72cb2d7941bce98489678f58a11655","audit_scope":"Independent read-only audit of committed Phase 3 mechanical-completion-round-1 artifacts, their SHA-256 identities, checkpoint ancestry, the exact pre-repair-to-implementation diff, production evidence bindings, and the twelve specified pre-economic fidelity conditions. No market-data file, external source repository, or holdout content was accessed.","checks":[{"check_number":1,"status":"PASS","finding":"The exact 124909a8f1da6d1e3a52d841aaf4d5e7fbfd877b..9eee066e0a72cb2d7941bce98489678f58a11655 diff changes six files. Runtime changes are limited to an eight-line strict UTC evidence serializer and one fold-evidence boundary call; all remaining changes are focused tests, authorization, and controller/evidence plumbing."},{"check_number":2,"status":"PASS","finding":"The serializer only transforms an evidence-field value after row indexing, session construction, fill construction, and terminal-fill selection. The economic module and its tests are byte-identical before and after repair, so rows, identities, gaps, eligibility, signals, targets, fills, clocks, prices, costs, sizing, accounting, returns, trials, statistics, gates, and holdout rules are unchanged."},{"check_number":3,"status":"PASS","finding":"serialize_utc_evidence_timestamp rejects naive and nonzero-offset datetimes, preserves a zero-offset UTC instant, and deterministically emits ISO-8601 with Z. Focused tests cover UTC JSON safety plus naive and non-UTC rejection."},{"check_number":4,"status":"PASS","finding":"Across pre-repair, implementation, checkpoint, and HEAD, PREREGISTRATION.json remains byte SHA-256 f8eb130bb3c1fc1670e369fa3b54007ee847bd6e4714ccfff28066a96124f567 and canonical SHA-256 5f4d41bbd9f3fc34b29e86da271d324a442520c87bacece160627c6051cd13b6; the effective contract remains byte SHA-256 1da897a3eff60a013181d6381fc20b9e7e1678cad6005dd6c9224fdb15385a77 and canonical SHA-256 9fca7dacc8fa2c58842b230763f6c33900e0ef0eb6055253ae0d559948aae8b1."},{"check_number":5,"status":"PASS","finding":"The promoted bound artifact names implementation commit 9eee066e0a72cb2d7941bce98489678f58a11655. Its pipeline, validation-driver, and production-test hashes exactly match those files at that commit: 3072c75e..., 204d79d0..., and 3c2f0cc2..., respectively."},{"check_number":6,"status":"PASS","finding":"verify_source_identity validates the exact 36-entry development allowlist and guards every selected relative path before read_verified_entry constructs a market-file candidate. The stage log records 36 development entries and zero holdout entries before market-path resolution; committed evidence records no holdout path, footer, or value access."},{"check_number":7,"status":"PASS","finding":"The evidence is internally linked and consistent: 36 partition rows sum to 790558 per asset; the partition manifest recomputes exactly; all four fold stage counts match the bound artifact; terminal-fill, session/trace, eligible/fill, and target/fill/disposition links agree; trace, cost, and representative-return manifests recompute exactly; both 14-bps and 28-bps representative reconciliations independently match."},{"check_number":8,"status":"PASS","finding":"The correctly bound run records exit status 0, 257.48 wall-clock seconds under the 1800-second ceiling, zero swaps, and no deadline trigger. The monotonic 47-record stage log ends with complete_artifact_written and the exact promoted artifact hash, so no partial result was promoted."},{"check_number":9,"status":"PASS","finding":"The mistyped declaration 9eee0662e5a8167f3ae3648306de05fdd25da314 is preserved as INVOCATION_ABORTED_COMMIT_BINDING_MISMATCH and explicitly barred from supporting a pass. Its substantive output equals the correctly bound rerun after excluding binding-specific fields; only the correctly bound rerun is promoted."},{"check_number":10,"status":"PASS","finding":"The artifacts explicitly record no aggregate strategy returns, Sharpe, drawdown, bootstrap, DSR, PBO, acceptance gates, economic result, performance claim, candidate promotion, or profitability conclusion. Only bounded representative mechanical accounting was reconciled."},{"check_number":11,"status":"PASS","finding":"Focused and repository-wide test results are recorded solely as tooling evidence. The validation artifact still classifies the result as pre-fidelity production mechanics, disallows performance claims, and requires this separate fidelity gate."},{"check_number":12,"status":"PASS","finding":"No substantive local implementation-fidelity defect was found. The implementation is fidelity-approved only for a separate formal development economic evaluation under the unchanged frozen preregistration; this approval is not an economic result or profitability claim."}],"findings":["Current HEAD 64cf0211924bd77f5080345241b7d201fed4bcc9 is clean, contains evidence checkpoint 2ea59cc1b777824b0a5ccf327dbe1b88e8b7dc0b, and all listed artifacts are unchanged from that checkpoint.","SHA-256 was recomputed for all fifteen requested artifacts. The promoted bound artifact and stage-log hashes are 9dff22992972f5eaed4630e4b098c6a7a79a7bcb1fec4fffea65b8d2c5e3f0af and e612eeced1c9dbe31e7090c57874110a4b60e20c062a6e507c3f93005b38f8b4.","This verdict authorizes only the next formal development economic evaluation under the frozen contract; it does not authorize holdout access, capital, orders, or any performance claim."],"formal_development_evaluation_authorized":true,"aggregate_strategy_returns_calculated":false,"performance_claim_made":false,"market_data_accessed":false,"holdout_accessed":false,"files_modified":false}
